{"schema_version":1,"id":"mistfall_depths","display_name":"四季鐘窟","max_floor":40,"boss_floors":[10,20,30,40],"elevator_interval":5,"season_zones":[{"season":"spring","from":1,"to":10},{"season":"summer","from":11,"to":20},{"season":"autumn","from":21,"to":30},{"season":"winter","from":31,"to":40}],"enemy_ids":["moss_slime","thorn_rat","pollen_wisp","ember_slime","cave_bat","magma_beetle","amber_slime","stone_boar","fog_wisp","ice_slime","frost_wolf","bell_guardian"],"boss_ids":["spring_root_guardian","summer_forge_drake","autumn_harvest_golem","winter_bell_warden"],"seal_ids":["spring_seal","summer_seal","autumn_seal","winter_seal"]}
